{
  "schema_version": 1,
  "project_id": "001-ai-race",
  "title": "The AI Race No One Can Afford to Win",
  "fps": 30,
  "duration_frames": 5700,
  "duration_seconds": 190,
  "proof": {
    "minimum_seconds": 150,
    "boundary_frame": 4500,
    "semantic_end": "The race is not driven by ignorance of the danger, but by fear of being the only actor that slows down.",
    "final_word": "down"
  },
  "policies": {
    "primary_source_capture_min_ratio": 0.3,
    "source_backed_min_ratio": 0.6,
    "max_continuous_evidence_seconds": 16,
    "primary_capture_min_seconds": 4,
    "max_fullscreen_graphic_ratio": 0.1,
    "max_generic_stock_ratio": 0.08,
    "max_asset_reuse_count": 4,
    "max_motif_reuse_count": 3,
    "mobile_min_font_px": 42
  },
  "sections": [
    {"id":"opening","title":"The Paradox","start_frame":0,"end_frame":1500},
    {"id":"race","title":"The Incentive","start_frame":1500,"end_frame":3000},
    {"id":"governance","title":"The Gap","start_frame":3000,"end_frame":4500},
    {"id":"ending","title":"The Question","start_frame":4500,"end_frame":5700}
  ],
  "shots": [
    {"id":"shot-001","section_id":"opening","start_frame":0,"end_frame":300,"visual_type":"primary_capture","asset":"assets/captures/nist-ai-rmf.png","source_ids":["src-nist"],"claim_ids":["claim-01"],"source_backed":true,"provenance_mode":"official_capture","full_screen_graphic":false,"motif":"official-page-a","mobile_font_px":42,"transition":{"type":"cut","duration_frames":0},"narration_text":"Canonical narration beat 1 for the AI race essay."},
    {"id":"shot-002","section_id":"opening","start_frame":300,"end_frame":600,"visual_type":"source_graphic","asset":"assets/graphics/graphic-incentive.svg","source_ids":["src-nist"],"claim_ids":["claim-02"],"source_backed":true,"provenance_mode":"source_derived","full_screen_graphic":false,"motif":"loop-diagram","mobile_font_px":48,"transition":{"type":"crossfade","duration_frames":12},"narration_text":"Canonical narration beat 2 for the AI race essay.","source_line":"Sources: src-nist"},
    {"id":"shot-003","section_id":"opening","start_frame":600,"end_frame":900,"visual_type":"physical_evidence","asset":"assets/captures/eu-ai-act.png","source_ids":["src-eu"],"claim_ids":["claim-03"],"source_backed":true,"provenance_mode":"physical_evidence","full_screen_graphic":false,"motif":"official-page-b","mobile_font_px":42,"transition":{"type":"crossfade","duration_frames":12},"narration_text":"Canonical narration beat 3 for the AI race essay."},
    {"id":"shot-004","section_id":"opening","start_frame":900,"end_frame":1200,"visual_type":"contextual_footage","asset":"assets/placeholders/context-lab.svg","source_ids":[],"claim_ids":[],"source_backed":false,"provenance_mode":"original","full_screen_graphic":false,"motif":"cinematic-context-a","mobile_font_px":42,"transition":{"type":"crossfade","duration_frames":12},"narration_text":"Canonical narration beat 4 for the AI race essay."},
    {"id":"shot-005","section_id":"opening","start_frame":1200,"end_frame":1500,"visual_type":"primary_capture","asset":"assets/captures/unesco-ai-ethics.png","source_ids":["src-unesco"],"claim_ids":["claim-04"],"source_backed":true,"provenance_mode":"official_capture","full_screen_graphic":false,"motif":"official-page-c","mobile_font_px":42,"transition":{"type":"crossfade","duration_frames":12},"narration_text":"Canonical narration beat 5 for the AI race essay."},
    {"id":"shot-006","section_id":"race","start_frame":1500,"end_frame":1800,"visual_type":"source_graphic","asset":"assets/graphics/graphic-governance.svg","source_ids":["src-eu","src-unesco"],"claim_ids":["claim-05"],"source_backed":true,"provenance_mode":"source_derived","full_screen_graphic":false,"motif":"comparison-a","mobile_font_px":48,"transition":{"type":"crossfade","duration_frames":12},"narration_text":"Canonical narration beat 6 for the AI race essay.","source_line":"Sources: src-eu, src-unesco"},
    {"id":"shot-007","section_id":"race","start_frame":1800,"end_frame":2100,"visual_type":"physical_evidence","asset":"assets/captures/nist-ai-rmf.png","source_ids":["src-nist"],"claim_ids":["claim-06"],"source_backed":true,"provenance_mode":"physical_evidence","full_screen_graphic":false,"motif":"official-page-a","mobile_font_px":42,"transition":{"type":"crossfade","duration_frames":12},"narration_text":"Canonical narration beat 7 for the AI race essay."},
    {"id":"shot-008","section_id":"race","start_frame":2100,"end_frame":2400,"visual_type":"contextual_footage","asset":"assets/placeholders/context-chip.svg","source_ids":[],"claim_ids":[],"source_backed":false,"provenance_mode":"original","full_screen_graphic":false,"motif":"cinematic-context-b","mobile_font_px":42,"transition":{"type":"crossfade","duration_frames":12},"narration_text":"Canonical narration beat 8 for the AI race essay."},
    {"id":"shot-009","section_id":"race","start_frame":2400,"end_frame":2700,"visual_type":"primary_capture","asset":"assets/captures/eu-ai-act.png","source_ids":["src-eu"],"claim_ids":["claim-07"],"source_backed":true,"provenance_mode":"official_capture","full_screen_graphic":false,"motif":"official-page-b","mobile_font_px":42,"transition":{"type":"crossfade","duration_frames":12},"narration_text":"Canonical narration beat 9 for the AI race essay."},
    {"id":"shot-010","section_id":"race","start_frame":2700,"end_frame":3000,"visual_type":"source_graphic","asset":"assets/graphics/graphic-comparison.svg","source_ids":["src-nist","src-eu"],"claim_ids":["claim-08"],"source_backed":true,"provenance_mode":"source_derived","full_screen_graphic":false,"motif":"comparison-b","mobile_font_px":48,"transition":{"type":"crossfade","duration_frames":12},"narration_text":"Canonical narration beat 10 for the AI race essay.","source_line":"Sources: src-nist, src-eu"},
    {"id":"shot-011","section_id":"governance","start_frame":3000,"end_frame":3300,"visual_type":"physical_evidence","asset":"assets/captures/unesco-ai-ethics.png","source_ids":["src-unesco"],"claim_ids":["claim-09"],"source_backed":true,"provenance_mode":"physical_evidence","full_screen_graphic":false,"motif":"official-page-c","mobile_font_px":42,"transition":{"type":"crossfade","duration_frames":12},"narration_text":"Canonical narration beat 11 for the AI race essay."},
    {"id":"shot-012","section_id":"governance","start_frame":3300,"end_frame":3600,"visual_type":"contextual_footage","asset":"assets/placeholders/context-grid.svg","source_ids":[],"claim_ids":[],"source_backed":false,"provenance_mode":"original","full_screen_graphic":false,"motif":"cinematic-context-c","mobile_font_px":42,"transition":{"type":"crossfade","duration_frames":12},"narration_text":"Canonical narration beat 12 for the AI race essay."},
    {"id":"shot-013","section_id":"governance","start_frame":3600,"end_frame":3900,"visual_type":"primary_capture","asset":"assets/captures/nist-ai-rmf.png","source_ids":["src-nist"],"claim_ids":["claim-10"],"source_backed":true,"provenance_mode":"official_capture","full_screen_graphic":false,"motif":"official-page-d","mobile_font_px":42,"transition":{"type":"crossfade","duration_frames":12},"narration_text":"Canonical narration beat 13 for the AI race essay."},
    {"id":"shot-014","section_id":"governance","start_frame":3900,"end_frame":4200,"visual_type":"source_graphic","asset":"assets/graphics/graphic-threshold.svg","source_ids":["src-nist"],"claim_ids":["claim-11"],"source_backed":true,"provenance_mode":"source_derived","full_screen_graphic":true,"motif":"threshold-graphic","mobile_font_px":48,"transition":{"type":"crossfade","duration_frames":12},"narration_text":"Canonical narration beat 14 for the AI race essay.","source_line":"Sources: src-nist"},
    {"id":"shot-015","section_id":"governance","start_frame":4200,"end_frame":4500,"visual_type":"source_graphic","asset":"assets/graphics/graphic-governance.svg","source_ids":["src-eu"],"claim_ids":["claim-12"],"source_backed":true,"provenance_mode":"source_derived","full_screen_graphic":false,"motif":"governance-graphic-b","mobile_font_px":48,"transition":{"type":"crossfade","duration_frames":12},"narration_text":"A completed paragraph ends here.","source_line":"Sources: src-eu"},
    {"id":"shot-016","section_id":"ending","start_frame":4500,"end_frame":4800,"visual_type":"primary_capture","asset":"assets/captures/unesco-ai-ethics.png","source_ids":["src-unesco"],"claim_ids":["claim-13"],"source_backed":true,"provenance_mode":"official_capture","full_screen_graphic":false,"motif":"official-page-f","mobile_font_px":42,"transition":{"type":"crossfade","duration_frames":12},"narration_text":"Canonical narration beat 16 for the AI race essay."},
    {"id":"shot-017","section_id":"ending","start_frame":4800,"end_frame":5100,"visual_type":"source_graphic","asset":"assets/graphics/graphic-question.svg","source_ids":["src-nist","src-eu","src-unesco"],"claim_ids":["claim-14"],"source_backed":true,"provenance_mode":"source_derived","full_screen_graphic":false,"motif":"question-graphic","mobile_font_px":48,"transition":{"type":"crossfade","duration_frames":12},"narration_text":"Canonical narration beat 17 for the AI race essay.","source_line":"Sources: src-nist, src-eu, src-unesco"},
    {"id":"shot-018","section_id":"ending","start_frame":5100,"end_frame":5400,"visual_type":"primary_capture","asset":"assets/captures/eu-ai-act.png","source_ids":["src-eu"],"claim_ids":["claim-15"],"source_backed":true,"provenance_mode":"official_capture","full_screen_graphic":false,"motif":"official-page-g","mobile_font_px":42,"transition":{"type":"crossfade","duration_frames":12},"narration_text":"Canonical narration beat 18 for the AI race essay."},